"http://info.raad.tartu.ee/webaktid.nsf/web/gpunid/GAB2143660AB15E7FC2257FD10052166B?OpenDocument"	"vaksal tänama tartu munitsipaalomand otsus kohalik eelnõu protokoll maaala linn istuma taotlemine linnavalitsus ülesanne linnavolikogu omavalitsusüksus seadus maaüksus lvip esitama"
"http://info.raad.tartu.ee/webaktid.nsf/web/gpunid/GE4E65F13B6C43FB7C2257FD2002CE807?OpenDocument"	"maa tartu tänama timut munitsipaalomand otsus maaüksus eelnõu aardla esitama vaksal linnavolikogu sihtotstarve linnavalitsus transpordimaa protokoll avaldus linn quotmaaalade alune"
"http://info.raad.tartu.ee/webaktid.nsf/web/gpunid/G9E96ABCD0090F73CC225800A002F5ECA?OpenDocument"	"riigihange koristusteenus otsus eelnõu tartu küün raekoda ostmine haldushoone linn quottartu linnavolikogu aquot plats quotloa korraldamiseksquot andmine protokoll esitamine käibemaks"
"http://info.raad.tartu.ee/webaktid.nsf/web/gpunid/G1F6EC47BA1E6CE02C225800A0040D24A?OpenDocument"	"linn tartu ostmine otsus riigihange üldine eelnõu tsiviilvastutuskindlustus aasta euro kahi quot quottartu linnavolikogu andmine quotloa korraldamiseksquot protokoll kolmas esitamine"
"http://info.raad.tartu.ee/webaktid.nsf/web/gpunid/G671C41802D43EDE9C225800A0038833C?OpenDocument"	"riigihange ostmine raamleping otsus autokütus eelnõu tartu linnavalitsus sõlmima struktuuriüksus aasta linnavolikogu sõlmimine aquot quotautokütus osakond quotloa korraldamiseksquot linnavara andmine"
"http://info.raad.tartu.ee/webaktid.nsf/web/gpunid/GE20482006EEAE671C225801A002CAA20?OpenDocument"	"eelnõu otsus tartu skulptuur koostamine väljakuulutamine läbirääkimine plats linnavolikogu rajamine tööprojekt jannne koidula quotloa korraldamiseksquot hange linnavalitsus andmine protokoll istuma"
"http://info.raad.tartu.ee/webaktid.nsf/web/gpunid/G7CE9DFC1E32BE45AC2257FF5002710DB?OpenDocument"	"liinivõrk tartu ühistransport analüüs töö otsus linn eelnõu teostamine optimeerimine linnavolikogu osa olemasolev riigihange quotloa korraldamiseksquot andmine protokoll aasta esitamine"
"http://info.raad.tartu.ee/webaktid.nsf/web/gpunid/G98E247188F80E16AC2258005002D23AC?OpenDocument"	"tartu otsus eelnõu linnavolikogu riigihange linnavalitsus quotloa korraldamiseksquot andmine protokoll esitamine istuma kummel kohane lvip finantseerimine linn kandma kantav võtma"
"http://info.raad.tartu.ee/webaktid.nsf/web/gpunid/G08FD8E0690EC1792C225801900473EEF?OpenDocument"	"teenus tartu otsus eelnõu sotsiaalabi isik riigihange quot linnavolikogu andmine quotvältimatu quotloa korraldamiseksquot linnavalitsus protokoll esitamine riideabi istuma alune vältimatu"
"http://info.raad.tartu.ee/webaktid.nsf/web/gpunid/G1BECDFEC2916BB2BC225801900465AA3?OpenDocument"	"otsus eelnõu tõlketeenus tartu quot linnavolikogu riigihange quotviipekeel quotloa korraldamiseksquot linnavalitsus andmine protokoll esitamine istuma aasta teenus käibemaks euro tund"
"http://info.raad.tartu.ee/webaktid.nsf/web/gpunid/G7F061BFE2A212B1DC2257FE6003CD02A?OpenDocument"	"tartu maakonnaplaneering linn keskkonnamõju hindamine strateegiline eelnõu otsus aruanne areng planeering seletuskiri kergliiklustee maakond linnavolikogu tulema peatükk lisa quottartumaa kooskõlastaminequot"
"http://info.raad.tartu.ee/webaktid.nsf/web/gpunid/G93EE5E1EEC23EBB2C225800B00227FC2?OpenDocument"	"tee krunt tartu ihane avalik väljapanek detailplaneering kallas otsus eelnõu linnavolikogu pos planeering linn parkimiskoht vastuvõtmine tulema koht koostamine quotkallas"
"http://info.raad.tartu.ee/webaktid.nsf/web/gpunid/G321C85FB42B755F3C22580170029303A?OpenDocument"	"krunt tartu otsus detailplaneering linnavolikogu eelnõu ilmatsalu planeering linn linnavalitsus maa kehtestaminequot kehtestamine quotilmatsalu protokoll asuma esitamine tänav istuma või"
"http://info.raad.tartu.ee/webaktid.nsf/web/gpunid/G7E1871C50556CD82C2257FBE0047C811?OpenDocument"	"otsus linnavolikogu tartu eelnõu quottartu kehtetu tunnistaminequot protokoll istuma kool linnavalitsus põhimäärusquot määrus põhimäärus lvip kandma juur kantav herbert täiskasvanu"
"http://info.raad.tartu.ee/webaktid.nsf/web/gpunid/GF373C3E4163AAEBAC2257FD4002A93B6?OpenDocument"	"riigihange tartu korraldamine linn linnavalitsus töö otsus luba protokoll eelnõu istuma andmine maanteeamet kergliiklustee tuhat korraldama volitama juurdepääs finantseerima eelarve"
"http://info.raad.tartu.ee/webaktid.nsf/web/gpunid/G8A65AE7E66A37145C2257FCB0021AB35?OpenDocument"	"otsus tartu tualett rent pst vabadus riigihange linnavolikogu hooldusquot quotloss eelnõu quotloa andmine protokoll korraldamiseksquot esitamine istuma linnavalitsus osakond lvip"
"http://info.raad.tartu.ee/webaktid.nsf/web/gpunid/G2490758C787BA09DC2257FCD0060EAFA?OpenDocument"	"tartu leping otsus eelnõu esitamine avalik bussiliinivedu riigihange linn teenus teenindamine linnavolikogu linnavalitsus sõlmima august tingimus quotloa pikendamiseksquot pakkumus andmine"
"http://info.raad.tartu.ee/webaktid.nsf/web/gpunid/G3F608AE39C5A07BEC2257FCD004BC6B4?OpenDocument"	"maa tartu munitsipaalomand otsus linnavalitsus raeremmelgas eelnõu protokoll korraldus linnavolikogu istuma taotlemine esitama osaline taotlema alune talu maaüksus lvip ahven"
"http://info.raad.tartu.ee/webaktid.nsf/web/gpunid/G2D5DE9F71DE6AFF1C2257FB50027C85F?OpenDocument"	"tartu kesklinn linn planeering üldplaneering otsus areng linnavolikogu avalik hindamine arvestama strateegiline keskkonnamõju ruumiline eelnõu seisukoht lisa põhimõte linnavalitsus alune"
"http://info.raad.tartu.ee/webaktid.nsf/web/gpunid/G92640CF20FA7C9D2C2257FAE004D90A5?OpenDocument"	"tartu krunt detailplaneering tee koostamine linn otsus keskkonnamõju aruküla hindamine algatamine linnavolikogu algatama strateegiline eelnõu üldplaneering planeering lähteseisukoht linnavalitsus maa"
"http://info.raad.tartu.ee/webaktid.nsf/web/gpunid/GDCDA9E904C958261C2257FAB0037C977?OpenDocument"	"krunt tartu avalik detailplaneering väljapanek otsus linn eelnõu ilmatsalu linnavolikogu planeering vastuvõtmine maa pos üldplaneering otstarve suunaminequot quotilmatsalu kasutamine lubama"
"http://info.raad.tartu.ee/webaktid.nsf/web/gpunid/G6F3A8A82AE295D22C2257FA000225620?OpenDocument"	"krunt detailplaneering pst tamm tartu kehtetu tunnistamine otsus kaar eelnõu linnavolikogu linnavalitsus osa suur osaline osakond esitama planeering omanik osasquot"
"http://info.raad.tartu.ee/webaktid.nsf/web/gpunid/GC2D1FCE4911CDB04C2257FC40027998F?OpenDocument"	"tartu otsus linnavolikogu krunt detailplaneering eelnõu planeering riia kehtestaminequot quotriia linn linnavalitsus protokoll esitamine kehtestamine istuma teadma või lvip õigusakt"
"http://info.raad.tartu.ee/webaktid.nsf/web/gpunid/G30621D26B7E829EFC2257FB6002EB418?OpenDocument"	"mln euro tartu linnavalitsus linn aruanne aasta võrra majandusaasta täitmine osatähtsus suurenema vähenema moodustama arengukava vastav otsus ülesanne põhivara linnavolikogu"
"http://info.raad.tartu.ee/webaktid.nsf/web/gpunid/G6763C2F124581D89C2257F9900496C69?OpenDocument"	"tartu linn eelarvestrateegia arengukava väljapanek otsus eelnõu avalik aasta linnavolikogu quottartu ülesanne projekt esitama ettepanek muutmisettepanek linnavalitsus lisa heakskiitmine omavalitsus"
"http://info.raad.tartu.ee/webaktid.nsf/web/gpunid/G34C23D7FF8A1C7A7C2257FB8001C3F1D?OpenDocument"	"tartu otsus eelnõu linnavalitsus üürileping linnavolikogu oÜga erinmets andmine äriruum quotloa sõlmimiseksquot ruum protokoll esitamine istuma korrus lvip mölder sõlmima"
"http://info.raad.tartu.ee/webaktid.nsf/web/gpunid/G2DE6259FA7E0B029C2257FB5002A57BA?OpenDocument"	"tartu projekt raatus kool õppehoone euro otsus eelnõu linn quottartu õppekeskkond linnavolikogu andmine quotloa esitamine rekonstrueeriminequot õpilane loomine protokoll võimalus"
"http://info.raad.tartu.ee/webaktid.nsf/web/gpunid/G8959C79246736569C2257FB90025C2A2?OpenDocument"	"tartu loodusaine gümnaasium otsus eelnõu praktiline poska jaan labor sisustus riigihange töö linnavolikogu viima võimaldama korraldamine quotloa ostmiseksquot erinev andmine"
"http://info.raad.tartu.ee/webaktid.nsf/web/gpunid/G7EE87FFA0E8B78B0C2257FB9002DC013?OpenDocument"	"tartu äriinkubaator projekt kosmoseagentuur aasta otsus tegevus euroopa toetamine quot ettevõte kohalik esa quoteuroopa eelnõu esitamine linnavolikogu linn vahend protokoll"
"http://info.raad.tartu.ee/webaktid.nsf/web/gpunid/G8519D066B6C63A67C2257FB8002726CE?OpenDocument"	"tartu krunt otsus küütr detailplaneering eelnõu linnavolikogu planeering linn linnavalitsus quotküütr kehtestaminequot kehtestamine protokoll esitamine istuma või kuu ehitusõigus päev"
"http://info.raad.tartu.ee/webaktid.nsf/web/gpunid/GB488D6077F3FE157C2257FB7002D25AD?OpenDocument"	"tartu otsus krunt detailplaneering kuperjanov eelnõu linnavolikogu planeering linn kehtestamine linnavalitsus kehtestaminequot üks quotj protokoll esitamine istuma või maa korterelamu"
"http://info.raad.tartu.ee/webaktid.nsf/web/gpunid/GFB5B46ACB57D9642C2257FA30034A26B?OpenDocument"	"valimiskomisjon tartu linn otsus eelnõu linnavolikogu jür seadus quottartu mölder nimetama moodustaminequot protokoll linnasekretär liige esitamine istuma jaanuar riigikogu valimine"
"http://info.raad.tartu.ee/webaktid.nsf/web/gpunid/G68FF5657EC8C25D6C2257FA1004884AA?OpenDocument"	"klaas tartu hoonestusõigus linnavara kinnistu tööstuspark kinnistuma võõrandamine linn otsustuskord ravila otsus artium linnavolikogu rand tuulberg alune linnavalitsus grupp asuv"
"http://info.raad.tartu.ee/webaktid.nsf/web/gpunid/G00F77C31D84C7CCFC2257FA3001FFE09?OpenDocument"	"tartu tööstuspark kinnistuma klaas otsus ravila eelnõu linnavolikogu asuv otsustuskord võõrandamine linnavalitsus aktsiaselts linn hind võõrandaminequot quot protokoll amp esitamine"
"http://info.raad.tartu.ee/webaktid.nsf/web/gpunid/GC2C09CF851AD89E3C2257F96002D9DF9?OpenDocument"	"aardla maa tartu munitsipaalomand linn kuuluv otsus vajalik eelnõu ehitis linnavalitsus teenindamine protokoll istuma taotlemine esitama alune lvip ahven linnavolikogu"
"http://info.raad.tartu.ee/webaktid.nsf/web/gpunid/G285CF93168703E9BC2257F7A004A5789?OpenDocument"	"tänama laser tartu maa osaline linnavalitsus ujula maaala esitama munitsipaalomand talu transpordimaa otsus sihtotstarve endine eelnõu taotlus kompenseerima linn tagastama"
"http://info.raad.tartu.ee/webaktid.nsf/web/gpunid/G396B28F65FBF4237C2257F790032FA76?OpenDocument"	"tartu laser maa linnavalitsus sihtotstarve maaüksus otsus pindala ujula kreutzwald maakasutus sälg esitama korraldus munitsipaalomand linnavolikogu osaline lamm üldkasutatav talu"
"http://info.raad.tartu.ee/webaktid.nsf/web/gpunid/G6DF69365EFEC14A3C2257F8E00284B9C?OpenDocument"	"tartu kava linn ühisveevärk arendamine kanalisatsioon otsus aasta linnavolikogu eelnõu quottartu väljapanek hea avalik projekt Üvk suunaminequot kiitmine protokoll koostamine"
"http://info.raad.tartu.ee/webaktid.nsf/web/gpunid/G2E3E2B96372EEF3CC2257F8B002E76BA?OpenDocument"	"tartu uitp linn rahvusvaheline transport ühendus liige internationa association public organisatsioon astumine otsus eelnõu protokoll osalemine lahendus valdkond istuma võimalus"
"http://info.raad.tartu.ee/webaktid.nsf/web/gpunid/G00F8A077C7FF8C59C2257F8D0038B8AB?OpenDocument"	"krunt tartu otsus detailplaneering võru eelnõu linnavolikogu linn planeering pind koostamine quotvõru lubama protokoll ehitisealune algataminequot esitamine pidama tulema üldplaneering"
"http://info.raad.tartu.ee/webaktid.nsf/web/gpunid/G92FC4428D869CF49C2257F9B002C3428?OpenDocument"	"tartu krunt detailplaneering avalik planeering väljapanek tee eelnõu otsus linnavolikogu linn vastuvõtmine maa koostamine kvissental suunaminequot üksikelamu linnavalitsus quotkvissental protokoll"
"http://info.raad.tartu.ee/webaktid.nsf/web/gpunid/GE10A35751A6B26F1C2257F50002C6DBC?OpenDocument"	"tartu krunt avalik väljapanek detailplaneering planeering otsus eelnõu linnavolikogu riia vastuvõtmine linn suunaminequot quotriia linnavalitsus protokoll esitamine istuma alg eesmärk"
"http://info.raad.tartu.ee/webaktid.nsf/web/gpunid/G0E025BF2F68757F5C2257F9B0026A13C?OpenDocument"	"tartu otsus detailplaneering krunt eelnõu linnavolikogu planeering linn vanemuis linnavalitsus kehtestaminequot kehtestamine quotvanemuis protokoll esitamine koostamine istuma või teadma hoone"
"http://info.raad.tartu.ee/webaktid.nsf/web/gpunid/G700C80CFA05BFA14C2257F9B002F7B8E?OpenDocument"	"tartu otsus krunt kroonuaed linnavolikogu detailplaneering eelnõu planeering kehtestaminequot linn linnavalitsus protokoll esitamine kehtestamine istuma quotkroonuaia lisa teadma hoone või"
"http://info.raad.tartu.ee/webaktid.nsf/web/gpunid/GD7E658599A3C8036C2257F800046607F?OpenDocument"	"tervisekeskus teenus linn tartu ehitamine hoonestusõigus osutamine esmatasand kinnisasi või meede omaja tegevusluba mnt narva otsus detailplaneering omand alune olev"
"http://info.raad.tartu.ee/webaktid.nsf/web/gpunid/G8710B2B21DE7E6AEC2257F8500417B08?OpenDocument"	"roos tartu hoonestusõigus otsus eelnõu linnavolikogu linn kinnistuma nimetama areng idee kuuluv quotloa koormamiseksquot linnavalitsus piirkond andmine tegevus raad protokoll"
"http://info.raad.tartu.ee/webaktid.nsf/web/gpunid/G0A9AC0A34C23FF78C2257F76004A66FE?OpenDocument"	"riigihange otsus tartu andmine eelnõu etapp protokoll korraldamine istuma roos linnavalitsus luba omanikujärelevalve euro lvip töö pära hankeleping aasta eelarve"
"http://info.raad.tartu.ee/webaktid.nsf/web/gpunid/G9F7A943946FF1FD3C2257F72004EAD8D?OpenDocument"	"tartu märgistustöö teekate eelnõu otsus riigihange linnavolikogu tänav linn töö quotloa korraldamiseksquot esitamine linnavalitsus andmine protokoll esitama aasta istuma teostama"
"http://info.raad.tartu.ee/webaktid.nsf/web/gpunid/G77C07DB00E9BD011C2257F72004DA558?OpenDocument"	"tartu foorisüsteem hooldustöö eelnõu otsus riigihange linn luba linnavolikogu seade foor korraldamine esitamine linnavalitsus andmine tõkkepuu protokoll tagama istuma töö"
"http://info.raad.tartu.ee/webaktid.nsf/web/gpunid/G98E1ACEAEAF3243EC2257F7E00284D0F?OpenDocument"	"tartu kool koristusteenus tamm otsus eelnõu riigihange linnavolikogu quotloa andmine protokoll korraldamine esitamine istuma ostmiseksquot ostmine linnavalitsus viima siseruum lvip"
"http://info.raad.tartu.ee/webaktid.nsf/web/gpunid/GCF6EA2B7D9BB8D83C2257F7E00445663?OpenDocument"	"tartu linn kinnistuma euro võõrandamine väärtus linnavolikogu otsus linnavara turg eelnõu tänav pindala kinnisvara kuuluv otsustuskord osaühing registriosa linnavalitsus andmine"
"http://info.raad.tartu.ee/webaktid.nsf/web/gpunid/GD041C30B2758331AC2257F61004F3265?OpenDocument"	"arengukava tartu linn koostamine keskkonnamõju otsus hindamine linnavolikogu strateegiline tegevus aasta algatama eelnõu algatamine quottartu linnavalitsus arvestama valdkond tulema koostama"
"http://info.raad.tartu.ee/webaktid.nsf/web/gpunid/GC45BCAD83AE48AADC2257F7F002B0C87?OpenDocument"	"üldplaneering tartu linn eskiislahendus avalik või krunt maa uus keskkonnamõju hindamine koostamine areng hoone ala kavandama programm linnavolikogu planeering otsus"
"http://info.raad.tartu.ee/webaktid.nsf/web/gpunid/GDE3B1F6133724EC1C2257F850021447A?OpenDocument"	"tartu krunt avalik planeering küütr väljapanek otsus detailplaneering eelnõu linnavolikogu linn vastuvõtmine quotküütr suunaminequot ehitusõigus hoone linnavalitsus protokoll esitamine istuma"
"http://info.raad.tartu.ee/webaktid.nsf/web/gpunid/GBDB82D0EBA3CF4DCC2257F840041AC89?OpenDocument"	"tartu detailplaneering otsus linnavolikogu krunt eelnõu ala planeering koostamine linn hoone linnavalitsus quotmõisavahe protokoll algataminequot esitamine istuma määr tervisekeskus mõisavahe"
"http://info.raad.tartu.ee/webaktid.nsf/web/gpunid/GFBB2F9E0052A10B6C2257F830069D797?OpenDocument"	"tartu detailplaneering raatus otsus narva mnt planeering põik eelnõu linnavolikogu vaheline kvartal ala krunt koostamine hoone linn linnavalitsus quotfortuuna fortuuna"
"http://info.raad.tartu.ee/webaktid.nsf/web/gpunid/G02B49A8359705A12C2257F7F0026617F?OpenDocument"	"tartu krunt avalik väljapanek otsus kuperjanov detailplaneering planeering eelnõu linnavolikogu linn vastuvõtmine korterelamu suunaminequot linnavalitsus quotj protokoll esitamine üks istuma"
"http://info.raad.tartu.ee/webaktid.nsf/web/gpunid/G06EEC004F14C3C7AC2257F7100279E48?OpenDocument"	"tartu krunt otsus planeering linnavolikogu detailplaneering eelnõu rebane pos lähiala hoone linn kehtestaminequot kehtestamine quotrebane linnavalitsus protokoll esitamine planeeringuala istuma"
"http://info.raad.tartu.ee/webaktid.nsf/web/gpunid/G7B24B5333258B714C2257F84001F2AFE?OpenDocument"	"tartu täht krunt detailplaneering linn avalik park planeering päev maa hoone üldplaneering ala osa otsus linnavolikogu ettepanek linnavalitsus esitama üldkasutatav"
"http://info.raad.tartu.ee/webaktid.nsf/web/gpunid/G95B0BF3F6F3052BEC2257F80002F6B9C?OpenDocument"	"tartu otsus riia krunt detailplaneering linnavolikogu planeering eelnõu hoone linn linnavalitsus kehtestaminequot quotriia lubama olemasolev protokoll suurim korrus või esitamine"
"http://info.raad.tartu.ee/webaktid.nsf/web/gpunid/GE4FD1FFDD37306E2C2257F7F003B7DB5?OpenDocument"	"tartu krunt detailplaneering otsus kastan eelnõu linnavolikogu planeering linn quotkastan kehtestaminequot linnavalitsus protokoll tiik esitamine kehtestamine koostamine lubama istuma avalik"
"http://info.raad.tartu.ee/webaktid.nsf/web/gpunid/G061A5DCA35643DB7C2257F610043D18B?OpenDocument"	"tartu liikluskorraldusvahend hooldustöö otsus eelnõu linn liiklusmärk linnavolikogu riigihange teostamine korrasolek hooldusperiood andmine tagama protokoll quotloa korraldamiseksquot esitamine istuma paigaldama"
"http://info.raad.tartu.ee/webaktid.nsf/web/gpunid/G03AB921A4526AE77C2257F5B00299037?OpenDocument"	"otsus tartu koostamine linnavolikogu detailplaneering krunt eelnõu kehtetu linnavalitsus lõpetama algatama lõpetamine quotdetailplaneering tunnistaminequot protokoll õnn korraldus projekteerimistingimus istuma esitamine"
"http://info.raad.tartu.ee/webaktid.nsf/web/gpunid/G3FEA26FBCCFFD38BC2257F5D00436405?OpenDocument"	"tartu krunt avalik detailplaneering väljapanek otsus eelnõu linnavolikogu vanemuis planeering vastuvõtmine linn hoone suunaminequot quotvanemuis protokoll esitamine istuma linnavalitsus lubama"
"http://info.raad.tartu.ee/webaktid.nsf/web/gpunid/GE24F2D5AF86CD5F3C2257F5E002B9565?OpenDocument"	"tartu krunt avalik väljapanek planeering otsus linnavolikogu detailplaneering eelnõu kroonuaed vastuvõtmine linn suunaminequot quotkroonuaia protokoll esitamine istuma linnavalitsus pindala ehitusalune"
"http://info.raad.tartu.ee/webaktid.nsf/web/gpunid/GC2257ED20030C63DC2257F0300452294?OpenDocument"	"tee kvissental nimi kohanimi tänav tartu määrama linnavalitsus otsus määramine katastriüksus aadress majavaldus seisukoht arvamus teeharu tänama järg eraldi omanik"
"http://info.raad.tartu.ee/webaktid.nsf/web/gpunid/GC2257ED20030C63DC2257F0700482A20?OpenDocument"	"tänav tartu nimi kohanimi otsus määramine pos määrama tähtveri linnaosa nimeobjekt eelnõu linnavolikogu tänama linnavalitsus protokoll kreutzwald istuma või kns"
"http://info.raad.tartu.ee/webaktid.nsf/web/gpunid/G68A3844F8FFF3D85C2257F33004DA8B3?OpenDocument"	"tartu auto sõiduauto otsus eelnõu töötav sõiduk liisimine riigihange linnavolikogu surugaas quotloa korraldamiseksquot andmine euro protokoll kaks kulg esitamine keskmine"
"http://info.raad.tartu.ee/webaktid.nsf/web/gpunid/GD34315A5FC5D0597C2257F480034709B?OpenDocument"	"projekt tartu tänav lasteaed jalgtee tegevuskava kergliiklustee lõik jalgratas kavandama euro summ laiune otsus Ülenurme heakskiitmine jätkusuutlik eelnõu aasta rühm"
"http://info.raad.tartu.ee/webaktid.nsf/web/gpunid/GC2257ED20030C63DC2257C9300489CBC?OpenDocument"	"tartu kaitseministeerium linn omand kinnistuma linnavalitsus roos võõrandamine tasu olev raatus riigikaitsemaa otsus taotlus linnavolikogu maa eelnõu varjupaik eesti kokkulepe"
"http://info.raad.tartu.ee/webaktid.nsf/web/gpunid/GC2257ED20030C63DC2257EC70044ECA0?OpenDocument"	"tartu krunt kastan detailplaneering planeering avalik linn väljapanek otsus linnavolikogu eelnõu vastuvõtmine tiik üldplaneering lubama linnavalitsus quotkastan suunaminequot koostamine protokoll"
"http://info.raad.tartu.ee/webaktid.nsf/web/gpunid/G927C03E54FBF60E1C2257F4E00418469?OpenDocument"	"hoone tartu detailplaneering planeering lina aleksander krunt tänav avalik linn ettepanek linnavalitsus selts osa ala seisukoht karlova pos arutelu vastuväide"
"http://info.raad.tartu.ee/webaktid.nsf/web/gpunid/G7B127B9E8F78F383C2257F4C004558F1?OpenDocument"	"krunt tartu detailplaneering paju otsus planeering kehtestamine ehituskeeluvöönd linnavolikogu kanal anne maa linn või vähendamine eelnõu hoone linnavalitsus avalik protokoll"
"http://info.raad.tartu.ee/webaktid.nsf/web/gpunid/G15FEB4C7D862D6B3C2257F4D0048D967?OpenDocument"	"tartu linn vald elanik omavalitsus teenus eelnõu muutmine haldusterritoriaalne korraldus otsus piirkond läbirääkimine suurem võimalus linnavolikogu luunja maakond ettepanek või"
"http://info.raad.tartu.ee/webaktid.nsf/web/gpunid/GCE9206824116A949C2257F4E00520614?OpenDocument"	"tartu täht otsus eelnõu linnavolikogu linn aukodanik nimetus andma quotaukodanik andminequot isik protokoll esitama esitamine istuma linnavalitsus andmine lvip klaas"
"http://info.raad.tartu.ee/webaktid.nsf/web/gpunid/GC2257ED20030C63DC2257ECA002D2976?OpenDocument"	"tartu nimi tänav kohanimi määramine ülikool otsus tänama määrama linnaosa asuv eelnõu nimeobjekt maarjamõis protokoll kohane ostwald istuma linnavalitsus kns"
"http://info.raad.tartu.ee/webaktid.nsf/web/gpunid/G24202B0B366D9FA4C2257F3300503F3A?OpenDocument"	"otsus tartu linnavolikogu eelnõu quottartu projekt raudteejaam ligipääsetavus arendamine suurendaminequot linnavalitsus quotloa andmine muutmine osalemiseksquot protokoll esitamine istuma euro linn"
"http://info.raad.tartu.ee/webaktid.nsf/web/gpunid/G8CCA2DE6ACCE9D04C2257F31002D41EB?OpenDocument"	"täht krunt tartu otsus detailplaneering kehtestamine planeering linnavolikogu hoone eelnõu linn linnavalitsus protokoll istuma kavandama teadma või planeerima apdfdp lvip"
"http://info.raad.tartu.ee/webaktid.nsf/web/gpunid/GC2257ED20030C63DC2257F2B004277B6?OpenDocument"	"tartu laulupidu krunt pst planeering detailplaneering otsus kehtestamine linnavolikogu puu linn linnavalitsus kavandama tähtveri eelnõu uus tulema protokoll juur sätestama"
"http://info.raad.tartu.ee/webaktid.nsf/web/gpunid/GC2257ED20030C63DC2257F2200562030?OpenDocument"	"tartu krunt otsus detailplaneering haab eelnõu planeering linnavolikogu linn kehtestaminequot quo kehtestamine linnavalitsus avalik protokoll esitamine tänav lubama istuma seadus"
"http://info.raad.tartu.ee/webaktid.nsf/web/gpunid/GC2257ED20030C63DC2257DDF0076E50A?OpenDocument"	"tartu krunt riia planeering avalik väljapanek otsus detailplaneering eelnõu linnavolikogu hoone linn vastuvõtmine korrus suunaminequot quotriia lubama olemasolev protokoll suurim"
"http://info.raad.tartu.ee/webaktid.nsf/web/gpunid/GC2257ED20030C63DC2257E9E0020B4F6?OpenDocument"	"tartu krunt planeering avalik väljapanek otsus detailplaneering eelnõu linnavolikogu hoone rebane pos lähiala linn vastuvõtmine planeeringuala suunaminequot ristmik quotrebane protokoll"
"http://info.raad.tartu.ee/webaktid.nsf/web/gpunid/GC2257ED20030C63DC2257F2B0031E4EA?OpenDocument"	"tartu mnt narva linn ülikool kesklinn otsus linnavolikogu võõrandamine luba maa otsustuskord eelnõu üldplaneering keskus ehitamine kinnisasi kuuluv quottartu õpp"
"http://info.raad.tartu.ee/webaktid.nsf/web/gpunid/GC2257ED20030C63DC2257EF500743054?OpenDocument"	"tartu elamuhaldus linn euro tuh otsus linnavolikogu linnavalitsus eelnõu eluruum ass osalemine aasta haldamine seadus aruandeaasta quottartu detsember osa lõpetaminequot"
"http://info.raad.tartu.ee/webaktid.nsf/web/gpunid/GC2257ED20030C63DC2257F0D002FCEDF?OpenDocument"	"tartu veekeskus aasta otsus rendileping euro linnavolikogu oÜga investeering andmine eelnõu quotloa sõlmimiseksquot protokoll esitamine ventilatsioonisüsteem istuma teostama linnavalitsus hoone"
"http://info.raad.tartu.ee/webaktid.nsf/web/gpunid/GC2257ED20030C63DC2257F0A002F8F72?OpenDocument"	"tartu otsus linn riia eelnõu linnavolikogu maaosa tänama krunt hind kuuluv otsustuskord lõunakeskus omand quotloa võõrandamiseksquot linnavara linnavalitsus andmine euro"
"http://info.raad.tartu.ee/webaktid.nsf/web/gpunid/GC2257ED20030C63DC2257F0F00046109?OpenDocument"	"otsus viivistasu julianu inkasso eksemplar või kolmas tartu linnavalitsus haldusleping täitmine haldusülesanne eelnõu linnavolikogu isik edastamine seadus oÜga sõiduk sõlmimine"
"http://info.raad.tartu.ee/webaktid.nsf/web/gpunid/GC2257ED20030C63DC2257F0A0040C3FF?OpenDocument"	"tartu projekt idapoolne ringtee otsus ehitusala ühendav jõhvitartuvalga tallinntartuluhamaa linnavalitsus linnavolikogu quotpõhimaantee linn ehitaminequot eelnõu esitamine euro andmine quotloa riigihange"
"http://info.raad.tartu.ee/webaktid.nsf/web/gpunid/GC2257ED20030C63DC2257EFC0020CDC2?OpenDocument"	"tartu lõuna aasta jää otsus eelnõu lõunakeskus liuväli hndl uus linnavolikogu klubi andmine euro quottoetus soodushind linn siseliuväli jääquot protokoll"
"http://info.raad.tartu.ee/webaktid.nsf/web/gpunid/GC2257ED20030C63DC2257EE0002C7264?OpenDocument"	"nimi tee tänav omanik määramine kvissental kohanimi katastriüksus tartu otsus eelnõu linnaosa aadress osakond järg nimeobjekt linnavalitsus protokoll kohanimeseadus linnavolikogu"
